{
  "lesson_id": "P01-M02-L01",
  "title": "Git Branching Fundamentals",
  "module_id": "P01-M02",
  "phase_id": "P01",
  "completed_at": "2025-12-13T00:00:00Z",
  "duration_minutes": 75,
  "confidence_rating": 5,
  "confidence_level": "high",
  "checkpoints_completed": 4,
  "assessment_results": {
    "checkpoint_1": {
      "questions_answered": 3,
      "quality": "exceptional",
      "notes": "Demonstrated clear understanding of branches as pointers, fast creation mechanism, and strategic value for CatchBook development"
    },
    "checkpoint_2": {
      "questions_answered": 3,
      "quality": "exceptional",
      "notes": "Precise technical understanding of git branch vs checkout -b, practical scenarios for separate creation, and design philosophy behind git switch"
    },
    "checkpoint_3": {
      "questions_answered": 3,
      "quality": "exceptional",
      "notes": "Professional workflow understanding of feature vs hotfix branches, scalability thinking on descriptive naming, independent discovery of ticket number integration"
    },
    "checkpoint_4": {
      "questions_answered": 3,
      "quality": "exceptional",
      "notes": "Comprehensive grasp of verbose flags, visualization benefits, hands-on verification of git alias creation"
    },
    "hands_on_exercise": {
      "completed": true,
      "quality": "exceptional",
      "notes": "Successfully created feature branch, made commits, visualized structure, verified isolation"
    }
  },
  "skills_developed": [
    "git_branching",
    "command_line_fluency",
    "professional_workflow_patterns",
    "systems_thinking"
  ],
  "key_takeaways": [
    "Branches are lightweight pointers to commits, not file copies",
    "Feature branches enable safe parallel development",
    "Branch naming conventions (feature/, bugfix/, hotfix/) create clarity at scale",
    "git log --graph --all --oneline visualizes branch structure",
    "git aliases improve workflow efficiency",
    "Hands-on exercise successfully applied concepts to CatchBook repository"
  ],
  "catchbook_deliverable": {
    "description": "Created feature/update-readme branch with development workflow documentation",
    "branch_created": "feature/update-readme",
    "commits_made": 1,
    "files_modified": ["README.md"]
  },
  "code_committed": true,
  "objectives_met": [
    "Explain what Git branches are and why they enable parallel development",
    "Create new branches using git branch and git checkout -b",
    "Switch between branches and understand HEAD pointer behavior",
    "List branches with git branch and identify the active branch",
    "Understand branch naming conventions (feature/, bugfix/, hotfix/)",
    "Visualize branch structure using git log --graph --all",
    "Apply feature branch workflow to CatchBook development"
  ],
  "struggles": [],
  "misconceptions_noted": [],
  "readiness_for_next_lesson": true,
  "professor_notes": "Exceptional performance across all checkpoints. Independently discovered professional best practices (ticket numbers in branch names). Demonstrated systems thinking by identifying curriculum structure issues and proposing architectural improvements. Ready to proceed to P01-M02-L02 after system refactoring is complete."
}
