{
  "lesson_id": "P01-M01-L02",
  "title": "Git Basics: Your First Repository",
  "module_id": "P01-M01",
  "phase_id": "P01",
  "completed_at": "2025-12-07T19:30:00Z",
  "duration_minutes": 90,
  "checkpoints_completed": 6,
  "assessment_results": {
    "checkpoint_1": {
      "questions_answered": 3,
      "understanding_level": "strong",
      "notes": "Correct Git version identification (2.51.2\u2014very current). Excellent insight on macOS developer demographics and Unix foundation. Accurate understanding of Homebrew's advantages for package management and version control."
    },
    "checkpoint_2": {
      "questions_answered": 3,
      "understanding_level": "exceptional",
      "notes": "Exemplary Git configuration (LFS, VS Code editor, global .gitignore). Perfect understanding of identity requirements (authorship, accountability, contributions graph). Clear explanation of global vs. local config scopes."
    },
    "checkpoint_3": {
      "questions_answered": 3,
      "understanding_level": "comprehensive",
      "notes": "Proper .git directory verification. Complete understanding of consequences of deletion. Accurate explanation of hidden directory convention (accidental deletion prevention, visual clarity, Unix tradition)."
    },
    "checkpoint_4": {
      "questions_answered": 3,
      "understanding_level": "exceptional",
      "notes": "Demonstrated problem-solving flexibility (echo vs touch). Perfect git status interpretation showing staged vs untracked files. Outstanding explanation of staging area purpose\u2014grasped the concept of selective commits enabling logical history. Ahead of many junior developers."
    },
    "checkpoint_5": {
      "questions_answered": 3,
      "understanding_level": "professional",
      "notes": "Correct commit history output. Accurate explanation of commit ID purpose (uniqueness, content-based, tamper-proof, referencing). Professional-grade commit message following Conventional Commits format."
    },
    "checkpoint_6": {
      "questions_answered": 3,
      "understanding_level": "exceptional",
      "notes": "4 commits with professional messages (exceeded requirements). Bonus challenge completed (.gitignore). Excellent attention to detail (notes.txt continuity observation). Balanced reflection showing command familiarity + new tool exposure (git log, echo)."
    }
  },
  "skills_developed": [
    "git_basics",
    "terminal_comfort",
    "markdown_documentation",
    "project_organization",
    "commit_message_writing",
    "repository_initialization"
  ],
  "key_takeaways": [
    "Git installation and configuration establishes professional development environment",
    "The three-state model (working directory \u2192 staging area \u2192 repository) is Git's core workflow",
    "The staging area enables selective commits for clean, logical history",
    "Commit messages are documentation\u2014use Conventional Commits format",
    "git status and git log are essential navigation tools for repository state",
    "Professional README.md documents project vision and technical architecture"
  ],
  "catchbook_deliverable": {
    "completed": true,
    "description": "CatchBook Git repository initialized with comprehensive README.md, .gitignore, and 4 professional commits demonstrating version control proficiency",
    "file_locations": [
      "~/dev/catchbook/.git",
      "~/dev/catchbook/README.md",
      "~/dev/catchbook/.gitignore"
    ]
  },
  "confidence_level": "high",
  "readiness_for_next_lesson": true,
  "professor_notes": "Exceptional performance. Jeff demonstrated professional-level Git workflow with clean commit history, proper message formatting, and deep understanding of the three-state model. Completed bonus challenge (.gitignore) and showed excellent attention to detail (notes.txt continuity observation). His existing command familiarity combined with new tool exposure (git log, echo) shows balanced learning. Configuration is exemplary (LFS, VS Code editor, global .gitignore)\u2014ready for advanced Git concepts and GitHub integration in L03/L04.",
  "confidence_rating": 5
}