{
  "lesson_id": "P01-M01-L03",
  "title": "Working with Remotes: Git Meets GitHub",
  "module_id": "P01-M01",
  "phase_id": "P01",
  "completed_at": "2025-12-09T00:00:00Z",
  "duration_minutes": 90,
  "checkpoints_completed": 4,
  "assessment_results": {
    "checkpoint_1": {
      "questions_answered": 3,
      "understanding_level": "exceptional",
      "notes": "Perfect distinction between Git (local VCS) and GitHub (cloud platform). Excellent prioritization of GitHub benefits (disaster recovery, portfolio, collaboration). Outstanding technical accuracy on commit storage in .git/ directory with real-world Lake Berryessa scenario showing understanding of unpushed commit vulnerability."
    },
    "checkpoint_2": {
      "questions_answered": 3,
      "understanding_level": "strong",
      "notes": "Smart choice of SSH authentication with solid rationale (already configured from previous work). Correct understanding of ssh-agent purpose (stores private keys in memory). Excellent explanation of Personal Access Token vs password distinction, including expiration and revocation benefits."
    },
    "checkpoint_3": {
      "questions_answered": 3,
      "understanding_level": "strong",
      "notes": "Correct explanation of git remote add origin establishing connection to remote repository. Perfect understanding of -u flag for upstream tracking enabling shorthand commands. Good grasp of code locations after push (local + GitHub), with additional technical detail provided on working directory vs .git/ database distinction."
    },
    "checkpoint_4": {
      "questions_answered": 3,
      "understanding_level": "exceptional",
      "notes": "Perfect technical explanation: git pull = git fetch + git merge. Excellent context-aware reasoning on solo vs team development workflows. Correct and concise git clone scenario (new machine without existing repo). Outstanding workflow visualization for two-computer sync pattern with proper pull-before-work discipline."
    }
  },
  "skills_developed": [
    "git_basics",
    "github_workflow",
    "remote_repository_management",
    "ssh_authentication",
    "multi_device_sync"
  ],
  "key_takeaways": [
    "Git (local VCS) and GitHub (cloud platform) are distinct but complementary tools",
    "GitHub provides disaster recovery, multi-device access, collaboration infrastructure, and portfolio visibility",
    "SSH keys with ssh-agent provide frictionless authentication for professional workflows",
    "git remote add origin establishes connection; git push -u sets upstream tracking for convenience",
    "git pull (fetch + merge) is appropriate for solo development; git fetch allows inspection before merge in team contexts",
    "git clone creates fresh local copy from remote; essential for new machines and collaboration",
    "Multi-device workflow: always git pull before starting work to avoid divergent histories"
  ],
  "catchbook_deliverable": {
    "completed": true,
    "description": "CatchBook repository pushed to GitHub with SSH authentication configured and upstream tracking established",
    "file_locations": [
      "github.com/jeff-hutting/catchbook",
      "~/dev/catchbook/.git (local repository)"
    ]
  },
  "confidence_level": "high",
  "readiness_for_next_lesson": true,
  "professor_notes": "Exceptional performance throughout. Jeff demonstrated complete mastery of remote workflows with perfect technical accuracy and context-aware reasoning. His existing SSH setup from The Odin Project / dev-curriculum work gave him a head start, and he leveraged it professionally. Understanding of authentication (SSH vs HTTPS), upstream tracking, and multi-device sync patterns is at professional level. The Lake Berryessa scenario and workflow diagrams show both technical precision and practical thinking. Ready for final module lesson (P01-M01-L04) to complete Git fundamentals.",
  "confidence_rating": 5
}