{
  "lesson_id": "P01-M02-L02",
  "title": "Creating Pull Requests",
  "module_id": "P01-M02",
  "phase_id": "P01",
  "completed_at": "2025-01-07T23:30:00Z",
  "duration_minutes": 90,
  "confidence_rating": 5,
  "confidence_level": "high",
  "checkpoints_completed": 4,
  "assessment_results": {
    "checkpoint_1": {
      "understanding_of_prs": "excellent",
      "github_flow_comprehension": "strong",
      "documentation_value_recognition": "excellent"
    },
    "checkpoint_2": {
      "upstream_tracking_understanding": "excellent",
      "workflow_rationale": "outstanding",
      "pr_description_analysis": "strong"
    },
    "checkpoint_3": {
      "issue_linking_mechanics": "excellent",
      "diff_debugging_approach": "correct_partial",
      "search_and_traceability": "excellent"
    },
    "checkpoint_4": {
      "pr_execution": "exemplary",
      "self_awareness": "advanced",
      "review_step_understanding": "excellent",
      "complexity_navigation": "excellent"
    }
  },
  "skills_developed": [
    "pull_request_workflow",
    "github_issue_management",
    "pr_description_writing",
    "diff_review",
    "issue_pr_linking",
    "remote_branch_management"
  ],
  "key_takeaways": [
    "Pull requests are proposals to merge changes that create review opportunities and preserve decision context",
    "GitHub Flow (branch → commit → push → PR → review → merge → delete) structures professional development",
    "Upstream tracking (-u flag) simplifies future push operations for new branches",
    "PR descriptions document 'why' behind changes - information not recoverable from code alone",
    "Issue/PR linking with 'Closes #N' creates full traceability and auto-closes issues on merge",
    "The 'Why' section in PR descriptions is most valuable long-term for understanding architectural decisions",
    "Diff review catches unintended changes, formatting issues, and line ending problems before merge",
    "PRs serve as remote backup for work-in-progress and enable multi-device workflows"
  ],
  "catchbook_deliverable": {
    "type": "pull_request",
    "description": "Opened and merged PR #1 to add development workflow documentation to README",
    "pr_url": "https://github.com/jeff-hutting/catchbook/pull/1",
    "issue_closed": "#2",
    "branch_merged": "feature/update-readme",
    "quality_assessment": "Professional-grade PR with excellent description structure, proper issue linking, clean diff, and appropriate metadata"
  },
  "code_committed": true,
  "objectives_met": [
    "Understand what pull requests are and why they're essential for code review",
    "Push feature branches to GitHub remote repository",
    "Open a pull request through GitHub web interface",
    "Write clear PR titles and descriptions using best practices",
    "Link PRs to GitHub issues for traceability",
    "Understand PR status checks and continuous integration basics",
    "Apply PR workflow to CatchBook feature development"
  ],
  "struggles": [
    "Initial uncertainty about merge commit message formatting (resolved through clarification)",
    "Recognizing 'unknown unknowns' in PR description content (demonstrates healthy self-awareness rather than actual struggle)"
  ],
  "misconceptions_noted": [
    "Minor: Thought -u flag applies when switching to any branch (clarified: only for new branches)",
    "Minor: Unsure about status checks timing (clarified: they run on push, not during manual review)"
  ],
  "readiness_for_next_lesson": true,
  "professor_notes": "Exceptional performance. Jeff demonstrated professional-level PR workflow execution on his first attempt. His PR #1 (https://github.com/jeff-hutting/catchbook/pull/1) exhibits textbook-perfect structure: Conventional Commits title, detailed What/Why/Changes/Testing/Notes description, proper issue linking, clean diff, and appropriate metadata. His checkpoint responses show deep understanding of GitHub Flow and the strategic value of PR documentation. The 'I don't know what I don't know' meta-awareness is advanced self-reflection. His 'breadcrumbs' analogy for issue/PR linking demonstrates conceptual mastery. Adapted independently to GitHub UI changes. Ready for P01-M02-L03 (Code Review & Collaboration)."
}
