{
  "lesson_id": "P01-M02-L03",
  "title": "Code Review & Collaboration",
  "module_id": "P01-M02",
  "phase_id": "P01",
  "completed_at": "2025-01-08T00:00:00Z",
  "duration_minutes": 120,
  "confidence_rating": 5,
  "confidence_level": "high",
  "checkpoints_completed": 5,
  "assessment_results": {
    "checkpoint_1": {
      "score": "exceptional",
      "notes": "Strong identification of code review value for solo developers. Excellent understanding of past/current/future-you knowledge transfer. Recognition of consistency benefits and portfolio value. Correctly identified that benefits compound over time."
    },
    "checkpoint_2": {
      "score": "exceptional",
      "notes": "Clear, accurate definitions of Approve/Request Changes/Comment actions. Excellent use of concrete CatchBook examples. Perfect understanding of line comments vs review-level comments. Self-review identified genuine documentation ambiguity (hotfix/* definition)."
    },
    "checkpoint_3": {
      "score": "exceptional",
      "notes": "Outstanding understanding of psychological safety in code review. Textbook-perfect tone transformation (harsh → constructive). Recognition of 'I am having trouble' vs 'Your code is confusing' distinction. Excellent grasp of must-fix vs nice-to-have prioritization."
    },
    "checkpoint_4": {
      "score": "exceptional",
      "notes": "Strong conceptual understanding despite not yet knowing JavaScript. Correct identification of readability (good variable names) as praise-worthy. Valid request for documentation. Accurate definitions of logic errors vs edge cases with appropriate CatchBook examples. Excellent articulation of documentation value."
    },
    "checkpoint_5": {
      "score": "exceptional",
      "notes": "Professional maturity demonstrated throughout. Complete workflow understanding (fix → commit → push → comment → re-request review). MASTERCLASS example: Smallmouth vs Largemouth Bass domain knowledge explanation. Recognition that explaining context is author's responsibility, not burden."
    },
    "self_review_exercise": {
      "score": "exceptional",
      "notes": "Three professional-quality line comments on own PR. Textbook-perfect constructive feedback on 'hotfix/*' definition ambiguity. Demonstrated all lesson principles: appreciation first, collaborative language, specific suggestions, appropriate humility. Excellent self-awareness and meta-cognition."
    }
  },
  "skills_developed": [
    "code_review",
    "constructive_feedback",
    "github_pr_review_tools",
    "tone_in_technical_communication",
    "self_review",
    "pr_iteration",
    "psychological_safety",
    "technical_communication"
  ],
  "key_takeaways": [
    "Code review serves dual purposes: quality gate (catching bugs) and learning opportunity (knowledge transfer)",
    "GitHub provides three review actions: Approve (ready to merge), Request Changes (blocking issues), Comment (non-blocking feedback)",
    "Constructive feedback structure: appreciation → observation → impact → suggestion → invitation to discuss",
    "Line comments address specific code issues; review-level comments address overall approach and architecture",
    "Start responses to review feedback with gratitude, even when feedback is difficult to receive",
    "PR update workflow: fix → commit → push to same branch → comment explaining changes → re-request review",
    "Explain reasoning when domain knowledge or tradeoffs aren't obvious; just fix when improvement is clear",
    "Self-review with fresh eyes catches 30-40% of bugs before others see them"
  ],
  "catchbook_deliverable": {
    "type": "process",
    "description": "Self-reviewed first CatchBook PR with professional-quality line comments. Identified documentation ambiguity in branch naming conventions. Demonstrated code review practices that will be applied to all 140+ future CatchBook modules."
  },
  "code_committed": false,
  "objectives_met": [
    "Understand the purpose and benefits of code review for software quality",
    "Leave constructive comments on GitHub PRs (line comments, review comments)",
    "Use GitHub review tools: approve, request changes, comment",
    "Apply code review best practices (kind, specific, actionable feedback)",
    "Respond to review feedback professionally and implement requested changes",
    "Push additional commits to update an open PR",
    "Understand when a PR is ready to merge vs needs more work"
  ],
  "struggles": [],
  "misconceptions_noted": [],
  "readiness_for_next_lesson": true,
  "professor_notes": "Exceptional performance across all checkpoints and self-review exercise. Demonstrated professional-level understanding of code review psychology, tone, and workflow. Self-review line comments were textbook-perfect examples of constructive feedback. Particularly impressive: (1) Recognition that consistency reduces cognitive load (systems thinking), (2) Masterclass tone transformation from harsh to collaborative, (3) Domain knowledge explanation (Smallmouth vs Largemouth Bass) showing understanding that explaining context is author's responsibility, (4) Self-awareness about emotional impact of criticism coupled with professional response patterns. The self-review exercise revealed excellent meta-cognitive abilities—caught genuine documentation ambiguity and demonstrated all lesson principles in practice. Ready for P01-M02-L04 (Merge Strategies & Conflict Resolution). No remediation needed. This lesson established code review habits that will compound throughout 140+ remaining modules."
}
